commit	score	status	description
314376a	1.000000	keep	keep run 2026-03-13T01-50-15-587Z-1 mode=copper_reference source=amiga_workspace/benchmarks/copper_bars/disk/copper_bars.adf rom=Kickstart v1.3 r34.005 (1987-12)(Commodore)(A500-A1000-A2000-CDTV).rom
314376a	1.000000	keep	keep run 2026-03-13T02-24-59-404Z-1 mode=sincos_scroller_reference source=amiga_workspace/benchmarks/sincos_scroller/reference/current.s rom=Kickstart v1.3 r34.005 (1987-12)(Commodore)(A500-A1000-A2000-CDTV).rom
314376a	1.000000	discard	discard run 2026-03-13T02-28-01-866Z-1 mode=sincos_scroller_reference source=amiga_workspace/benchmarks/sincos_scroller/reference/current.s rom=Kickstart v1.3 r34.005 (1987-12)(Commodore)(A500-A1000-A2000-CDTV).rom
314376a	0.963701	keep	keep run 2026-03-13T02-43-14-757Z-1 mode=sincos_scroller_control source=amiga_workspace/benchmarks/sincos_scroller/control/current.s rom=Kickstart v1.3 r34.005 (1987-12)(Commodore)(A500-A1000-A2000-CDTV).rom
314376a	1.000000	keep	keep run 2026-03-13T03-38-01-396Z-2 mode=playfield_marker source=amiga_workspace/benchmarks/copper_bars/asm_playfield_marker/current.s rom=Kickstart v1.3 r34.005 (1987-12)(Commodore)(A500-A1000-A2000-CDTV).rom
314376a	1.000000	discard	discard run 2026-03-13T03-38-17-799Z-3 mode=playfield_marker source=amiga_workspace/benchmarks/copper_bars/asm_playfield_marker/current.s rom=Kickstart v1.3 r34.005 (1987-12)(Commodore)(A500-A1000-A2000-CDTV).rom
314376a	1.000000	discard	discard run 2026-03-13T03-38-33-408Z-4 mode=playfield_marker source=amiga_workspace/benchmarks/copper_bars/asm_playfield_marker/current.s rom=Kickstart v1.3 r34.005 (1987-12)(Commodore)(A500-A1000-A2000-CDTV).rom
314376a	1.000000	discard	discard run 2026-03-13T03-38-49-213Z-5 mode=playfield_marker source=amiga_workspace/benchmarks/copper_bars/asm_playfield_marker/current.s rom=Kickstart v1.3 r34.005 (1987-12)(Commodore)(A500-A1000-A2000-CDTV).rom
314376a	1.000000	discard	discard run 2026-03-13T03-39-04-877Z-6 mode=playfield_marker source=amiga_workspace/benchmarks/copper_bars/asm_playfield_marker/current.s rom=Kickstart v1.3 r34.005 (1987-12)(Commodore)(A500-A1000-A2000-CDTV).rom
314376a	1.000000	discard	discard run 2026-03-13T03-39-21-014Z-7 mode=playfield_marker source=amiga_workspace/benchmarks/copper_bars/asm_playfield_marker/current.s rom=Kickstart v1.3 r34.005 (1987-12)(Commodore)(A500-A1000-A2000-CDTV).rom
314376a	1.000000	discard	discard run 2026-03-13T03-39-36-707Z-8 mode=playfield_marker source=amiga_workspace/benchmarks/copper_bars/asm_playfield_marker/current.s rom=Kickstart v1.3 r34.005 (1987-12)(Commodore)(A500-A1000-A2000-CDTV).rom
314376a	1.000000	discard	discard run 2026-03-13T03-39-52-542Z-9 mode=playfield_marker source=amiga_workspace/benchmarks/copper_bars/asm_playfield_marker/current.s rom=Kickstart v1.3 r34.005 (1987-12)(Commodore)(A500-A1000-A2000-CDTV).rom
314376a	1.000000	discard	discard run 2026-03-13T03-40-08-325Z-10 mode=playfield_marker source=amiga_workspace/benchmarks/copper_bars/asm_playfield_marker/current.s rom=Kickstart v1.3 r34.005 (1987-12)(Commodore)(A500-A1000-A2000-CDTV).rom
314376a	1.000000	discard	discard run 2026-03-13T03-40-24-108Z-11 mode=playfield_marker source=amiga_workspace/benchmarks/copper_bars/asm_playfield_marker/current.s rom=Kickstart v1.3 r34.005 (1987-12)(Commodore)(A500-A1000-A2000-CDTV).rom
314376a	1.000000	discard	discard run 2026-03-13T03-40-39-749Z-12 mode=playfield_marker source=amiga_workspace/benchmarks/copper_bars/asm_playfield_marker/current.s rom=Kickstart v1.3 r34.005 (1987-12)(Commodore)(A500-A1000-A2000-CDTV).rom
314376a	1.000000	discard	discard run 2026-03-13T03-40-55-504Z-13 mode=playfield_marker source=amiga_workspace/benchmarks/copper_bars/asm_playfield_marker/current.s rom=Kickstart v1.3 r34.005 (1987-12)(Commodore)(A500-A1000-A2000-CDTV).rom
314376a	1.000000	discard	discard run 2026-03-13T03-41-11-276Z-14 mode=playfield_marker source=amiga_workspace/benchmarks/copper_bars/asm_playfield_marker/current.s rom=Kickstart v1.3 r34.005 (1987-12)(Commodore)(A500-A1000-A2000-CDTV).rom
314376a	1.000000	discard	discard run 2026-03-13T03-41-27-076Z-15 mode=playfield_marker source=amiga_workspace/benchmarks/copper_bars/asm_playfield_marker/current.s rom=Kickstart v1.3 r34.005 (1987-12)(Commodore)(A500-A1000-A2000-CDTV).rom
314376a	1.000000	discard	discard run 2026-03-13T03-41-42-788Z-16 mode=playfield_marker source=amiga_workspace/benchmarks/copper_bars/asm_playfield_marker/current.s rom=Kickstart v1.3 r34.005 (1987-12)(Commodore)(A500-A1000-A2000-CDTV).rom
314376a	1.000000	discard	discard run 2026-03-13T03-41-58-521Z-17 mode=playfield_marker source=amiga_workspace/benchmarks/copper_bars/asm_playfield_marker/current.s rom=Kickstart v1.3 r34.005 (1987-12)(Commodore)(A500-A1000-A2000-CDTV).rom
314376a	1.000000	discard	discard run 2026-03-13T03-42-14-268Z-18 mode=playfield_marker source=amiga_workspace/benchmarks/copper_bars/asm_playfield_marker/current.s rom=Kickstart v1.3 r34.005 (1987-12)(Commodore)(A500-A1000-A2000-CDTV).rom
314376a	1.000000	discard	discard run 2026-03-13T03-42-30-032Z-19 mode=playfield_marker source=amiga_workspace/benchmarks/copper_bars/asm_playfield_marker/current.s rom=Kickstart v1.3 r34.005 (1987-12)(Commodore)(A500-A1000-A2000-CDTV).rom
314376a	1.000000	discard	discard run 2026-03-13T03-42-45-869Z-20 mode=playfield_marker source=amiga_workspace/benchmarks/copper_bars/asm_playfield_marker/current.s rom=Kickstart v1.3 r34.005 (1987-12)(Commodore)(A500-A1000-A2000-CDTV).rom
314376a	1.000000	discard	discard run 2026-03-13T03-43-01-714Z-21 mode=playfield_marker source=amiga_workspace/benchmarks/copper_bars/asm_playfield_marker/current.s rom=Kickstart v1.3 r34.005 (1987-12)(Commodore)(A500-A1000-A2000-CDTV).rom
314376a	1.000000	discard	discard run 2026-03-13T03-43-17-546Z-22 mode=playfield_marker source=amiga_workspace/benchmarks/copper_bars/asm_playfield_marker/current.s rom=Kickstart v1.3 r34.005 (1987-12)(Commodore)(A500-A1000-A2000-CDTV).rom
314376a	1.000000	discard	discard run 2026-03-13T03-43-33-279Z-23 mode=playfield_marker source=amiga_workspace/benchmarks/copper_bars/asm_playfield_marker/current.s rom=Kickstart v1.3 r34.005 (1987-12)(Commodore)(A500-A1000-A2000-CDTV).rom
314376a	1.000000	discard	discard run 2026-03-13T03-43-49-237Z-24 mode=playfield_marker source=amiga_workspace/benchmarks/copper_bars/asm_playfield_marker/current.s rom=Kickstart v1.3 r34.005 (1987-12)(Commodore)(A500-A1000-A2000-CDTV).rom
314376a	1.000000	discard	discard run 2026-03-13T03-44-05-074Z-25 mode=playfield_marker source=amiga_workspace/benchmarks/copper_bars/asm_playfield_marker/current.s rom=Kickstart v1.3 r34.005 (1987-12)(Commodore)(A500-A1000-A2000-CDTV).rom
314376a	1.000000	discard	discard run 2026-03-13T03-44-20-807Z-26 mode=playfield_marker source=amiga_workspace/benchmarks/copper_bars/asm_playfield_marker/current.s rom=Kickstart v1.3 r34.005 (1987-12)(Commodore)(A500-A1000-A2000-CDTV).rom
314376a	1.000000	discard	discard run 2026-03-13T03-44-37-523Z-27 mode=playfield_marker source=amiga_workspace/benchmarks/copper_bars/asm_playfield_marker/current.s rom=Kickstart v1.3 r34.005 (1987-12)(Commodore)(A500-A1000-A2000-CDTV).rom
314376a	1.000000	discard	discard run 2026-03-13T03-44-53-250Z-28 mode=playfield_marker source=amiga_workspace/benchmarks/copper_bars/asm_playfield_marker/current.s rom=Kickstart v1.3 r34.005 (1987-12)(Commodore)(A500-A1000-A2000-CDTV).rom
314376a	1.000000	discard	discard run 2026-03-13T03-45-09-056Z-29 mode=playfield_marker source=amiga_workspace/benchmarks/copper_bars/asm_playfield_marker/current.s rom=Kickstart v1.3 r34.005 (1987-12)(Commodore)(A500-A1000-A2000-CDTV).rom
314376a	1.000000	discard	discard run 2026-03-13T03-45-24-891Z-30 mode=playfield_marker source=amiga_workspace/benchmarks/copper_bars/asm_playfield_marker/current.s rom=Kickstart v1.3 r34.005 (1987-12)(Commodore)(A500-A1000-A2000-CDTV).rom
314376a	1.000000	discard	discard run 2026-03-13T03-45-40-691Z-31 mode=playfield_marker source=amiga_workspace/benchmarks/copper_bars/asm_playfield_marker/current.s rom=Kickstart v1.3 r34.005 (1987-12)(Commodore)(A500-A1000-A2000-CDTV).rom
314376a	1.000000	discard	discard run 2026-03-13T03-45-56-499Z-32 mode=playfield_marker source=amiga_workspace/benchmarks/audio_tone/reference/current.s rom=Kickstart v1.3 r34.005 (1987-12)(Commodore)(A500-A1000-A2000-CDTV).rom
314376a	1.000000	discard	discard run 2026-03-13T03-46-12-330Z-33 mode=playfield_marker source=amiga_workspace/benchmarks/copper_bars/asm_playfield_marker/current.s rom=Kickstart v1.3 r34.005 (1987-12)(Commodore)(A500-A1000-A2000-CDTV).rom
314376a	1.000000	discard	discard run 2026-03-13T03-46-28-167Z-34 mode=playfield_marker source=amiga_workspace/benchmarks/audio_tone/reference/current.s rom=Kickstart v1.3 r34.005 (1987-12)(Commodore)(A500-A1000-A2000-CDTV).rom
314376a	1.000000	discard	discard run 2026-03-13T03-46-44-035Z-35 mode=playfield_marker source=amiga_workspace/benchmarks/copper_bars/asm_playfield_marker/current.s rom=Kickstart v1.3 r34.005 (1987-12)(Commodore)(A500-A1000-A2000-CDTV).rom
314376a	1.000000	discard	discard run 2026-03-13T03-46-59-860Z-36 mode=playfield_marker source=amiga_workspace/benchmarks/copper_bars/asm_playfield_marker/current.s rom=Kickstart v1.3 r34.005 (1987-12)(Commodore)(A500-A1000-A2000-CDTV).rom
314376a	1.000000	discard	discard run 2026-03-13T03-47-15-731Z-37 mode=playfield_marker source=amiga_workspace/benchmarks/audio_tone/reference/current.s rom=Kickstart v1.3 r34.005 (1987-12)(Commodore)(A500-A1000-A2000-CDTV).rom
314376a	1.000000	discard	discard run 2026-03-13T03-47-31-571Z-38 mode=playfield_marker source=amiga_workspace/benchmarks/copper_bars/asm_playfield_marker/current.s rom=Kickstart v1.3 r34.005 (1987-12)(Commodore)(A500-A1000-A2000-CDTV).rom
314376a	1.000000	discard	discard run 2026-03-13T03-47-47-313Z-39 mode=playfield_marker source=amiga_workspace/benchmarks/copper_bars/asm_playfield_marker/current.s rom=Kickstart v1.3 r34.005 (1987-12)(Commodore)(A500-A1000-A2000-CDTV).rom
314376a	1.000000	discard	discard run 2026-03-13T03-48-03-165Z-40 mode=playfield_marker source=amiga_workspace/benchmarks/copper_bars/asm_playfield_marker/current.s rom=Kickstart v1.3 r34.005 (1987-12)(Commodore)(A500-A1000-A2000-CDTV).rom
314376a	1.000000	discard	discard run 2026-03-13T03-48-19-676Z-41 mode=playfield_marker source=amiga_workspace/benchmarks/copper_bars/asm_playfield_marker/current.s rom=Kickstart v1.3 r34.005 (1987-12)(Commodore)(A500-A1000-A2000-CDTV).rom
314376a	1.000000	discard	discard run 2026-03-13T03-48-35-486Z-42 mode=playfield_marker source=amiga_workspace/benchmarks/copper_bars/asm_playfield_marker/current.s rom=Kickstart v1.3 r34.005 (1987-12)(Commodore)(A500-A1000-A2000-CDTV).rom
314376a	1.000000	discard	discard run 2026-03-13T03-48-51-332Z-43 mode=playfield_marker source=amiga_workspace/benchmarks/copper_bars/asm_playfield_marker/current.s rom=Kickstart v1.3 r34.005 (1987-12)(Commodore)(A500-A1000-A2000-CDTV).rom
314376a	1.000000	discard	discard run 2026-03-13T03-49-07-169Z-44 mode=playfield_marker source=amiga_workspace/benchmarks/copper_bars/asm_playfield_marker/current.s rom=Kickstart v1.3 r34.005 (1987-12)(Commodore)(A500-A1000-A2000-CDTV).rom
314376a	1.000000	discard	discard run 2026-03-13T03-49-22-995Z-45 mode=playfield_marker source=amiga_workspace/benchmarks/audio_tone/reference/current.s rom=Kickstart v1.3 r34.005 (1987-12)(Commodore)(A500-A1000-A2000-CDTV).rom
314376a	1.000000	discard	discard run 2026-03-13T03-49-38-762Z-46 mode=playfield_marker source=amiga_workspace/benchmarks/copper_bars/asm_playfield_marker/current.s rom=Kickstart v1.3 r34.005 (1987-12)(Commodore)(A500-A1000-A2000-CDTV).rom
314376a	1.000000	discard	discard run 2026-03-13T03-49-54-604Z-47 mode=playfield_marker source=amiga_workspace/benchmarks/copper_bars/asm_playfield_marker/current.s rom=Kickstart v1.3 r34.005 (1987-12)(Commodore)(A500-A1000-A2000-CDTV).rom
314376a	1.000000	discard	discard run 2026-03-13T03-50-10-410Z-48 mode=playfield_marker source=amiga_workspace/benchmarks/copper_bars/asm_playfield_marker/current.s rom=Kickstart v1.3 r34.005 (1987-12)(Commodore)(A500-A1000-A2000-CDTV).rom
314376a	1.000000	discard	discard run 2026-03-13T03-50-26-325Z-49 mode=playfield_marker source=amiga_workspace/benchmarks/copper_bars/asm_playfield_marker/current.s rom=Kickstart v1.3 r34.005 (1987-12)(Commodore)(A500-A1000-A2000-CDTV).rom
314376a	1.000000	discard	discard run 2026-03-13T03-50-42-200Z-50 mode=playfield_marker source=amiga_workspace/benchmarks/copper_bars/asm_playfield_marker/current.s rom=Kickstart v1.3 r34.005 (1987-12)(Commodore)(A500-A1000-A2000-CDTV).rom
314376a	1.000000	discard	discard run 2026-03-13T03-50-58-048Z-51 mode=playfield_marker source=amiga_workspace/benchmarks/audio_tone/reference/current.s rom=Kickstart v1.3 r34.005 (1987-12)(Commodore)(A500-A1000-A2000-CDTV).rom
314376a	1.000000	discard	discard run 2026-03-13T03-51-13-856Z-52 mode=playfield_marker source=amiga_workspace/benchmarks/copper_bars/asm_playfield_marker/current.s rom=Kickstart v1.3 r34.005 (1987-12)(Commodore)(A500-A1000-A2000-CDTV).rom
314376a	1.000000	discard	discard run 2026-03-13T03-51-30-084Z-53 mode=playfield_marker source=amiga_workspace/benchmarks/copper_bars/asm_playfield_marker/current.s rom=Kickstart v1.3 r34.005 (1987-12)(Commodore)(A500-A1000-A2000-CDTV).rom
314376a	1.000000	discard	discard run 2026-03-13T03-51-46-600Z-54 mode=playfield_marker source=amiga_workspace/benchmarks/copper_bars/asm_playfield_marker/current.s rom=Kickstart v1.3 r34.005 (1987-12)(Commodore)(A500-A1000-A2000-CDTV).rom
314376a	1.000000	discard	discard run 2026-03-13T03-52-02-691Z-55 mode=playfield_marker source=amiga_workspace/benchmarks/copper_bars/asm_playfield_marker/current.s rom=Kickstart v1.3 r34.005 (1987-12)(Commodore)(A500-A1000-A2000-CDTV).rom
314376a	1.000000	discard	discard run 2026-03-13T03-52-18-853Z-56 mode=playfield_marker source=amiga_workspace/benchmarks/copper_bars/asm_playfield_marker/current.s rom=Kickstart v1.3 r34.005 (1987-12)(Commodore)(A500-A1000-A2000-CDTV).rom
314376a	1.000000	discard	discard run 2026-03-13T03-52-36-217Z-57 mode=playfield_marker source=amiga_workspace/benchmarks/audio_tone/reference/current.s rom=Kickstart v1.3 r34.005 (1987-12)(Commodore)(A500-A1000-A2000-CDTV).rom
314376a	1.000000	discard	discard run 2026-03-13T03-52-52-314Z-58 mode=playfield_marker source=amiga_workspace/benchmarks/copper_bars/asm_playfield_marker/current.s rom=Kickstart v1.3 r34.005 (1987-12)(Commodore)(A500-A1000-A2000-CDTV).rom
314376a	1.000000	discard	discard run 2026-03-13T03-53-08-565Z-59 mode=playfield_marker source=amiga_workspace/benchmarks/copper_bars/asm_playfield_marker/current.s rom=Kickstart v1.3 r34.005 (1987-12)(Commodore)(A500-A1000-A2000-CDTV).rom
314376a	1.000000	discard	discard run 2026-03-13T03-53-25-872Z-60 mode=playfield_marker source=amiga_workspace/benchmarks/copper_bars/asm_playfield_marker/current.s rom=Kickstart v1.3 r34.005 (1987-12)(Commodore)(A500-A1000-A2000-CDTV).rom
314376a	1.000000	discard	discard run 2026-03-13T03-53-42-151Z-61 mode=playfield_marker source=amiga_workspace/benchmarks/copper_bars/asm_playfield_marker/current.s rom=Kickstart v1.3 r34.005 (1987-12)(Commodore)(A500-A1000-A2000-CDTV).rom
314376a	1.000000	discard	discard run 2026-03-13T03-53-58-352Z-62 mode=playfield_marker source=amiga_workspace/benchmarks/copper_bars/asm_playfield_marker/current.s rom=Kickstart v1.3 r34.005 (1987-12)(Commodore)(A500-A1000-A2000-CDTV).rom
314376a	1.000000	discard	discard run 2026-03-13T03-54-14-471Z-63 mode=playfield_marker source=amiga_workspace/benchmarks/copper_bars/asm_playfield_marker/current.s rom=Kickstart v1.3 r34.005 (1987-12)(Commodore)(A500-A1000-A2000-CDTV).rom
314376a	1.000000	discard	discard run 2026-03-13T03-54-30-872Z-64 mode=playfield_marker source=amiga_workspace/benchmarks/copper_bars/asm_playfield_marker/current.s rom=Kickstart v1.3 r34.005 (1987-12)(Commodore)(A500-A1000-A2000-CDTV).rom
314376a	1.000000	discard	discard run 2026-03-13T03-54-47-669Z-65 mode=playfield_marker source=amiga_workspace/benchmarks/copper_bars/asm_playfield_marker/current.s rom=Kickstart v1.3 r34.005 (1987-12)(Commodore)(A500-A1000-A2000-CDTV).rom
314376a	1.000000	discard	discard run 2026-03-13T03-55-03-901Z-66 mode=playfield_marker source=amiga_workspace/benchmarks/audio_tone/reference/current.s rom=Kickstart v1.3 r34.005 (1987-12)(Commodore)(A500-A1000-A2000-CDTV).rom
314376a	1.000000	discard	discard run 2026-03-13T03-55-19-883Z-67 mode=playfield_marker source=amiga_workspace/benchmarks/copper_bars/asm_playfield_marker/current.s rom=Kickstart v1.3 r34.005 (1987-12)(Commodore)(A500-A1000-A2000-CDTV).rom
314376a	1.000000	discard	discard run 2026-03-13T03-55-36-180Z-68 mode=playfield_marker source=amiga_workspace/benchmarks/copper_bars/asm_playfield_marker/current.s rom=Kickstart v1.3 r34.005 (1987-12)(Commodore)(A500-A1000-A2000-CDTV).rom
314376a	1.000000	discard	discard run 2026-03-13T03-55-52-500Z-69 mode=playfield_marker source=amiga_workspace/benchmarks/copper_bars/asm_playfield_marker/current.s rom=Kickstart v1.3 r34.005 (1987-12)(Commodore)(A500-A1000-A2000-CDTV).rom
314376a	1.000000	discard	discard run 2026-03-13T03-56-08-697Z-70 mode=playfield_marker source=amiga_workspace/benchmarks/audio_tone/reference/current.s rom=Kickstart v1.3 r34.005 (1987-12)(Commodore)(A500-A1000-A2000-CDTV).rom
314376a	1.000000	discard	discard run 2026-03-13T03-56-24-898Z-71 mode=playfield_marker source=amiga_workspace/benchmarks/copper_bars/asm_playfield_marker/current.s rom=Kickstart v1.3 r34.005 (1987-12)(Commodore)(A500-A1000-A2000-CDTV).rom
314376a	1.000000	discard	discard run 2026-03-13T03-56-41-017Z-72 mode=playfield_marker source=amiga_workspace/benchmarks/copper_bars/asm_playfield_marker/current.s rom=Kickstart v1.3 r34.005 (1987-12)(Commodore)(A500-A1000-A2000-CDTV).rom
314376a	1.000000	discard	discard run 2026-03-13T03-56-57-331Z-73 mode=playfield_marker source=amiga_workspace/benchmarks/copper_bars/asm_playfield_marker/current.s rom=Kickstart v1.3 r34.005 (1987-12)(Commodore)(A500-A1000-A2000-CDTV).rom
314376a	1.000000	discard	discard run 2026-03-13T03-57-14-022Z-74 mode=playfield_marker source=amiga_workspace/benchmarks/copper_bars/asm_playfield_marker/current.s rom=Kickstart v1.3 r34.005 (1987-12)(Commodore)(A500-A1000-A2000-CDTV).rom
314376a	1.000000	discard	discard run 2026-03-13T03-57-30-233Z-75 mode=playfield_marker source=amiga_workspace/benchmarks/copper_bars/asm_playfield_marker/current.s rom=Kickstart v1.3 r34.005 (1987-12)(Commodore)(A500-A1000-A2000-CDTV).rom
314376a	1.000000	discard	discard run 2026-03-13T03-57-46-449Z-76 mode=playfield_marker source=amiga_workspace/benchmarks/copper_bars/asm_playfield_marker/current.s rom=Kickstart v1.3 r34.005 (1987-12)(Commodore)(A500-A1000-A2000-CDTV).rom
314376a	1.000000	discard	discard run 2026-03-13T03-58-02-875Z-77 mode=playfield_marker source=amiga_workspace/benchmarks/copper_bars/asm_playfield_marker/current.s rom=Kickstart v1.3 r34.005 (1987-12)(Commodore)(A500-A1000-A2000-CDTV).rom
314376a	1.000000	discard	discard run 2026-03-13T03-58-19-172Z-78 mode=playfield_marker source=amiga_workspace/benchmarks/copper_bars/asm_playfield_marker/current.s rom=Kickstart v1.3 r34.005 (1987-12)(Commodore)(A500-A1000-A2000-CDTV).rom
314376a	1.000000	discard	discard run 2026-03-13T03-58-36-333Z-79 mode=playfield_marker source=amiga_workspace/benchmarks/audio_tone/reference/current.s rom=Kickstart v1.3 r34.005 (1987-12)(Commodore)(A500-A1000-A2000-CDTV).rom
314376a	1.000000	discard	discard run 2026-03-13T03-58-52-537Z-80 mode=playfield_marker source=amiga_workspace/benchmarks/audio_tone/control/current.s rom=Kickstart v1.3 r34.005 (1987-12)(Commodore)(A500-A1000-A2000-CDTV).rom
314376a	1.000000	discard	discard run 2026-03-13T03-59-08-602Z-81 mode=playfield_marker source=amiga_workspace/benchmarks/copper_bars/asm_playfield_marker/current.s rom=Kickstart v1.3 r34.005 (1987-12)(Commodore)(A500-A1000-A2000-CDTV).rom
314376a	1.000000	discard	discard run 2026-03-13T03-59-24-682Z-82 mode=playfield_marker source=amiga_workspace/benchmarks/copper_bars/asm_playfield_marker/current.s rom=Kickstart v1.3 r34.005 (1987-12)(Commodore)(A500-A1000-A2000-CDTV).rom
314376a	1.000000	discard	discard run 2026-03-13T03-59-40-889Z-83 mode=playfield_marker source=amiga_workspace/benchmarks/copper_bars/asm_playfield_marker/current.s rom=Kickstart v1.3 r34.005 (1987-12)(Commodore)(A500-A1000-A2000-CDTV).rom
314376a	1.000000	discard	discard run 2026-03-13T03-59-57-161Z-84 mode=playfield_marker source=amiga_workspace/benchmarks/copper_bars/asm_playfield_marker/current.s rom=Kickstart v1.3 r34.005 (1987-12)(Commodore)(A500-A1000-A2000-CDTV).rom
314376a	1.000000	discard	discard run 2026-03-13T04-00-13-331Z-85 mode=playfield_marker source=amiga_workspace/benchmarks/copper_bars/asm_playfield_marker/current.s rom=Kickstart v1.3 r34.005 (1987-12)(Commodore)(A500-A1000-A2000-CDTV).rom
314376a	1.000000	discard	discard run 2026-03-13T04-00-29-437Z-86 mode=playfield_marker source=amiga_workspace/benchmarks/copper_bars/asm_playfield_marker/current.s rom=Kickstart v1.3 r34.005 (1987-12)(Commodore)(A500-A1000-A2000-CDTV).rom
314376a	1.000000	discard	discard run 2026-03-13T04-00-45-483Z-87 mode=playfield_marker source=amiga_workspace/benchmarks/copper_bars/asm_playfield_marker/current.s rom=Kickstart v1.3 r34.005 (1987-12)(Commodore)(A500-A1000-A2000-CDTV).rom
314376a	1.000000	discard	discard run 2026-03-13T04-01-01-398Z-88 mode=playfield_marker source=amiga_workspace/benchmarks/audio_tone/reference/current.s rom=Kickstart v1.3 r34.005 (1987-12)(Commodore)(A500-A1000-A2000-CDTV).rom
314376a	1.000000	discard	discard run 2026-03-13T04-01-17-447Z-89 mode=playfield_marker source=amiga_workspace/benchmarks/copper_bars/asm_playfield_marker/current.s rom=Kickstart v1.3 r34.005 (1987-12)(Commodore)(A500-A1000-A2000-CDTV).rom
